{
  "gameVersion": "S2 2.323[C]",
  "catalogVersion": "2.323",
  "scope": "nightmare-otherworld",
  "collectedOn": "2026-10-21",
  "source": "https://ordr.kr/character",
  "verification": "tooltip-numeric-facts",
  "specCompleteness": "partial",
  "warning": "캐릭터별 스킬 tooltip에서 확인 가능한 수치의 데이터 등록이다. 스킬 조건·대상 선택·일부 피해 계산식은 원본 스크립트와 추가 대조가 필요하다. 'trigger'는 도감 문구를 코드 관리용 용어로 표준화했으며 원본 JASS의 실제 스킬 rawcode와 다르다. 일부 캐릭터는 툴팁과 패치노트 사이에 수치 상충이 있으므로 해당 항목을 uncertaintyNotes로 기록하며 최종 전투 계산에 직접 투입하지 않는다. L01~L12 스킬은 2.323 도감 상세 페이지를 2026-10-21 재확인하여 구조화. 구 패치와 툴팁이 불일치하는 값은 uncertaintyNotes에 남겼다. L13~L24도 도감 2.323 상세 페이지를 확인. 최신 툴팁과 패치 이력의 차이를 별도 불확실성 필드로 유지한다.",
  "profiles": [
    {
      "unitId": "R-42",
      "sourceUrl": "https://ordr.kr/character/R42",
      "passives": [],
      "skills": [
        {
          "name": "단일 타격·스턴",
          "trigger": "onAttack",
          "chancePercent": 10,
          "target": "single",
          "components": [
            {
              "type": "physical",
              "amount": 10000
            },
            {
              "type": "stun",
              "durationSeconds": 0.6
            }
          ]
        },
        {
          "name": "매혹 계열 범위 공격",
          "trigger": "onAttack",
          "chancePercent": 10,
          "radius": 350,
          "target": "targetCircle",
          "components": [
            {
              "type": "magical",
              "amount": 6000
            },
            {
              "type": "explosive",
              "basis": "targetCurrentHealth",
              "percent": 10,
              "onlyTargetKinds": [
                "line"
              ],
              "scope": "singlePrimaryTarget"
            }
          ]
        }
      ],
      "skillSpecCompleteness": "partial",
      "gameRawCode": null,
      "basicAttack": {
        "nominalAttackPower": null,
        "intervalSeconds": null,
        "range": null,
        "damageSchool": null
      },
      "unconfirmedFields": [
        "원본 JASS 스킬 rawcode",
        "기본 공격 수치",
        "공격 주기",
        "실제 스킬 판정 순서"
      ]
    },
    {
      "unitId": "H-10",
      "sourceUrl": "https://ordr.kr/character/H10",
      "passives": [],
      "skills": [
        {
          "name": "맥시멈 스윙",
          "trigger": "activeMana",
          "manaCost": 100,
          "target": "targetCircle",
          "radius": 600,
          "components": [
            {
              "type": "magical",
              "amount": 1250000
            },
            {
              "type": "stun",
              "durationSeconds": 2.5
            },
            {
              "type": "armorBreak",
              "stacks": 4
            },
            {
              "type": "armorReduction",
              "amount": 18,
              "radius": 800,
              "durationSeconds": 5
            }
          ]
        },
        {
          "name": "기본 공격 발동형 타격",
          "trigger": "onAttack",
          "chancePercent": 20,
          "target": "targetCircle",
          "radius": 400,
          "components": [
            {
              "type": "physical",
              "amount": 240000
            },
            {
              "type": "armorBreak",
              "stacks": 1
            }
          ]
        }
      ],
      "skillSpecCompleteness": "partial",
      "gameRawCode": null,
      "basicAttack": {
        "nominalAttackPower": null,
        "intervalSeconds": null,
        "range": null,
        "damageSchool": null
      },
      "unconfirmedFields": [
        "원본 JASS 스킬 rawcode",
        "기본 공격 수치",
        "공격 주기",
        "실제 스킬 판정 순서"
      ]
    },
    {
      "unitId": "TR-16",
      "sourceUrl": "https://ordr.kr/character/TR16",
      "passives": [
        {
          "type": "movementSlowAura",
          "percent": 70
        },
        {
          "type": "explosiveDamageAmplification",
          "percent": 10,
          "targetZone": "line",
          "exclusiveWith": [
            "아오키지(히든)"
          ]
        },
        {
          "type": "onBasicHitSlow",
          "percent": 20
        }
      ],
      "skills": [
        {
          "name": "아이스 에이지",
          "trigger": "onAttack",
          "chancePercent": 12.5,
          "manaAtLeast": 50,
          "manaCost": 40,
          "castTimeSeconds": 0.5,
          "target": "targetCircle",
          "radius": 700,
          "components": [
            {
              "type": "magical",
              "amount": 2250000
            },
            {
              "type": "stun",
              "durationSeconds": 3
            }
          ]
        },
        {
          "name": "얼음얼음 열매",
          "trigger": "onAttack",
          "chancePercent": 10,
          "target": "area",
          "radius": 550,
          "components": [
            {
              "type": "magical",
              "amountPerHit": 240000,
              "hits": 2
            },
            {
              "type": "stun",
              "durationSeconds": 2.3
            }
          ]
        },
        {
          "name": "페잔트백",
          "trigger": "onAttack",
          "chancePercent": 4,
          "target": "area",
          "radius": 700,
          "components": [
            {
              "type": "magical",
              "amountPerHit": 125000,
              "hits": 3
            }
          ]
        },
        {
          "name": "아이스 사브르",
          "trigger": "onAttack",
          "chancePercent": 7,
          "target": "area",
          "radius": 450,
          "components": [
            {
              "type": "magical",
              "amount": 325000
            }
          ]
        }
      ],
      "enhancedChanges": [
        {
          "type": "replacePassive",
          "name": "movementSlowAura",
          "percent": 80
        },
        {
          "type": "addEffect",
          "skill": "아이스 에이지",
          "effect": {
            "type": "explosiveDamageAmplification",
            "percent": 5,
            "target": "affectedArea"
          }
        },
        {
          "type": "addPassive",
          "name": "manaRegeneration",
          "perSecond": 0.33
        }
      ],
      "enhancedDescription": "아이스 에이지 강화와 공중이동 추가; 원본 강화 후 전체 스킬 수치 대조 필요",
      "skillSpecCompleteness": "partial",
      "gameRawCode": null,
      "basicAttack": {
        "nominalAttackPower": null,
        "intervalSeconds": null,
        "range": null,
        "damageSchool": null
      },
      "unconfirmedFields": [
        "원본 JASS 스킬 rawcode",
        "기본 공격 수치",
        "공격 주기",
        "실제 스킬 판정 순서"
      ]
    },
    {
      "unitId": "TR-20",
      "sourceUrl": "https://ordr.kr/character/TR20",
      "passives": [
        {
          "type": "armorReductionAura",
          "amount": 30
        },
        {
          "type": "movementSlowAura",
          "percent": 30
        }
      ],
      "skills": [
        {
          "name": "1080 번뇌봉",
          "trigger": "activeMana",
          "manaCost": 145,
          "target": "area",
          "radius": 525,
          "components": [
            {
              "type": "magical",
              "amount": 2000000,
              "multiplierRange": [
                1,
                2.5
              ]
            },
            {
              "type": "physicalDamageOverTime",
              "perTick": 120000,
              "tickIntervalSeconds": 0.1,
              "totalDurationSeconds": 1.15,
              "affectedBy": [
                "초월함 업그레이드",
                "관통 초월함 업그레이드",
                "버프"
              ]
            },
            {
              "type": "stun",
              "durationSeconds": 3,
              "ignoresResistance": true
            }
          ]
        },
        {
          "name": "사자의 노래 Lv.2",
          "trigger": "onAttack",
          "chancePercent": 17,
          "target": "area",
          "radius": 415,
          "components": [
            {
              "type": "physical",
              "amount": 572500,
              "multiplierRange": [
                1,
                1.5
              ]
            },
            {
              "type": "singleTargetPhysicalBonus",
              "percent": 150
            },
            {
              "type": "stun",
              "durationSeconds": 2,
              "scope": "single"
            },
            {
              "type": "strengthScaling",
              "aoePerStrength": 6000,
              "singlePerStrength": 60000
            }
          ]
        },
        {
          "name": "삼도류 - 까마귀 마물 사냥",
          "trigger": "onAttack",
          "chancePercent": 7,
          "target": "area",
          "radius": 500,
          "components": [
            {
              "type": "physical",
              "amountPerHit": 350000,
              "hits": 3
            }
          ]
        },
        {
          "name": "삼도류 - 극 호랑이 사냥",
          "trigger": "onAttack",
          "chancePercent": 3,
          "target": "area",
          "radius": 500,
          "components": [
            {
              "type": "physical",
              "amount": 2500000
            },
            {
              "type": "stun",
              "durationSeconds": 2.5
            },
            {
              "type": "strengthScaling",
              "percentPerStrength": 2,
              "appliesTo": "삼도류 스킬"
            }
          ]
        },
        {
          "name": "크리티컬 타격",
          "trigger": "onAttack",
          "chancePercent": 25,
          "target": "single",
          "components": [
            {
              "type": "criticalMultiplier",
              "value": 10
            },
            {
              "type": "stun",
              "durationSeconds": 3
            },
            {
              "type": "physical",
              "amount": 200000
            }
          ]
        }
      ],
      "enhancedChanges": [
        {
          "type": "replacePassive",
          "name": "armorReductionAura",